ID,Date,Customer Company,Contact Name,Field Contact Name,Component,Geo,Industry Vertical,Environment,Customer Type,Status,Main AI Use Case,Tools of Choice,Pain Points,Feature Feedback,Future Wishlist,PM Comments
int-001,2024-01-15,Acme Corporation,John Smith,Jane Doe,vLLM,NA,Financial Services,Cloud,Enterprise,Discovery,Document Processing,"PyTorch, Hugging Face",Slow inference performance,Would like multi-modal support,"GPU optimization, Batch processing",Follow up in Q2
int-002,2024-01-20,TechStart Inc,Alice Johnson,Bob Wilson,Model Serving,EMEA,Healthcare,On-prem,Mid-market,Evaluating,Medical Image Analysis,TensorFlow,Complex deployment process,Dashboard UI is unclear,"One-click deployment, Better docs",Needs security review
int-003,2024-02-01,DataCorp,Charlie Brown,Diana Prince,RAG + Vector DB,APAC,Retail,Hybrid,Enterprise,Feedback Received,Customer Support Chatbot,"LangChain, ChromaDB",Vector search accuracy issues,Retrieval speed is good,"Hybrid search, Re-ranking",Ready for POC
int-004,2024-02-10,AI Labs,Eve Adams,Frank Miller,Training,NA,Technology,Cloud,Strategic,Lead,Model Fine-tuning,PyTorch,Need distributed training support,Training UI is intuitive,"AutoML, Hyperparameter tuning",High priority account
int-005,2024-02-15,Global Bank,Grace Lee,Henry Ford,Agentic,EMEA,Financial Services,Cloud,Enterprise,Discovery,Automated Trading Agents,LangChain,Agent reliability concerns,Multi-agent orchestration works well,"Better monitoring, Fail-safes",Compliance review needed
